<?xml version="1.0" encoding="UTF-8"?>
<xs:schema xmlns:xs="http://www.w3.org/2001/XMLSchema">
    <xs:element name="inventario">
        <xs:complexType>
            <xs:sequence>
                <xs:element name="items">
                    <xs:complexType>
                        <xs:sequence>
                            <xs:element name="item" maxOccurs="unbounded">
                                <xs:complexType>
                                    <xs:sequence>
                                        <xs:element name="nombre" type="xs:string"/>
                                        <xs:element name="cantidad" type="xs:integer"/>
                                    </xs:sequence>
                                    <xs:attribute name="id" type="xs:ID"/>
                                </xs:complexType>
                            </xs:element>
                        </xs:sequence>
                    </xs:complexType>
                </xs:element>
                <xs:element name="pedidos">
                    <xs:complexType>
                        <xs:sequence>
                            <xs:element name="pedido" maxOccurs="unbounded">
                                <xs:complexType>
                                    <xs:sequence>
                                        <xs:element name="itemRef" maxOccurs="unbounded">
                                            <xs:complexType>
                                                <xs:attribute name="itemID" type="xs:IDREF"/>
                                            </xs:complexType>
                                        </xs:element>
                                    </xs:sequence>
                                </xs:complexType>
                            </xs:element>
                        </xs:sequence>
                    </xs:complexType>
                </xs:element>
            </xs:sequence>
        </xs:complexType>
    </xs:element>
</xs:schema>